{"schema_version":1,"command":"wise-host-open","summary":"Run or contact the WISE host opener bridge","unknown_policy":"error","bindings":{"bash":{"unknown_destination":null}},"ui":{"confirm":""},"items":[{"id":"interface.help","kind":"option","type":"boolean","destination":"UNIOPT_BUILTIN_HELP","bindings":{"bash":{"destination":"UNIOPT_BUILTIN_HELP","default_function":null,"validator":null}},"short":"-h","long":"--help","negative_long":"","metavar":"","help":"Show help and exit","required":false,"repeatable":false,"internal":false,"default":"false","dynamic_default":null,"environment_default":null,"store_constant":null,"ui":{"label":"","group":"","control":"hidden","placeholder":"","advanced":false,"order":null,"min":null,"max":null,"step":null,"file_mode":"auto"},"choices":[],"sets":[]},{"id":"interface.gui","kind":"option","type":"boolean","destination":"UNIOPT_BUILTIN_GUI","bindings":{"bash":{"destination":"UNIOPT_BUILTIN_GUI","default_function":null,"validator":null}},"short":"","long":"--gui","negative_long":"","metavar":"","help":"Open the graphical command-line advisor","required":false,"repeatable":false,"internal":false,"default":"false","dynamic_default":null,"environment_default":null,"store_constant":null,"ui":{"label":"","group":"","control":"hidden","placeholder":"","advanced":false,"order":null,"min":null,"max":null,"step":null,"file_mode":"auto"},"choices":[],"sets":[]},{"id":"session.env_file","kind":"option","type":"path","destination":"ENV_FILE","bindings":{"bash":{"destination":"ENV_FILE","default_function":null,"validator":null}},"short":"","long":"--env-file","negative_long":"","metavar":"PATH","help":"Env file to use","required":false,"repeatable":false,"internal":false,"default":null,"dynamic_default":null,"environment_default":null,"store_constant":null,"ui":{"label":"Environment file","group":"Session","control":"auto","placeholder":"","advanced":false,"order":20,"min":null,"max":null,"step":null,"file_mode":"auto"},"choices":[],"sets":[]},{"id":"session.name","kind":"option","type":"string","destination":"OV_NAME","bindings":{"bash":{"destination":"OV_NAME","default_function":null,"validator":null}},"short":"","long":"--name","negative_long":"","metavar":"NAME","help":"Select a named WISE session","required":false,"repeatable":false,"internal":false,"default":null,"dynamic_default":null,"environment_default":null,"store_constant":null,"ui":{"label":"Session name","group":"Session","control":"auto","placeholder":"","advanced":false,"order":10,"min":null,"max":null,"step":null,"file_mode":"auto"},"choices":[],"sets":[]},{"id":"bridge.socket","kind":"option","type":"path","destination":"SOCKET_PATH","bindings":{"bash":{"destination":"SOCKET_PATH","default_function":null,"validator":null}},"short":"","long":"--socket","negative_long":"","metavar":"PATH","help":"Override the host-open socket path","required":false,"repeatable":false,"internal":false,"default":null,"dynamic_default":null,"environment_default":null,"store_constant":null,"ui":{"label":"","group":"Bridge","control":"auto","placeholder":"","advanced":false,"order":10,"min":null,"max":null,"step":null,"file_mode":"auto"},"choices":[],"sets":[]},{"id":"bridge.open_command","kind":"option","type":"string","destination":"OPEN_COMMAND","bindings":{"bash":{"destination":"OPEN_COMMAND","default_function":null,"validator":null}},"short":"","long":"--open-command","negative_long":"","metavar":"CMD","help":"Host opener command","required":false,"repeatable":false,"internal":false,"default":null,"dynamic_default":null,"environment_default":null,"store_constant":null,"ui":{"label":"","group":"Bridge","control":"auto","placeholder":"","advanced":false,"order":20,"min":null,"max":null,"step":null,"file_mode":"auto"},"choices":[],"sets":[]},{"id":"bridge.once","kind":"option","type":"boolean","destination":"ONCE","bindings":{"bash":{"destination":"ONCE","default_function":null,"validator":null}},"short":"","long":"--once","negative_long":"","metavar":"","help":"Serve one request and exit","required":false,"repeatable":false,"internal":false,"default":"false","dynamic_default":null,"environment_default":null,"store_constant":null,"ui":{"label":"","group":"Bridge","control":"auto","placeholder":"","advanced":false,"order":30,"min":null,"max":null,"step":null,"file_mode":"auto"},"choices":[],"sets":[]},{"id":"bridge.test_mode","kind":"option","type":"boolean","destination":"TEST_MODE","bindings":{"bash":{"destination":"TEST_MODE","default_function":null,"validator":null}},"short":"","long":"--test-mode","negative_long":"","metavar":"","help":"Print accepted targets instead of opening","required":false,"repeatable":false,"internal":false,"default":"false","dynamic_default":null,"environment_default":null,"store_constant":null,"ui":{"label":"","group":"Bridge","control":"auto","placeholder":"","advanced":false,"order":40,"min":null,"max":null,"step":null,"file_mode":"auto"},"choices":[],"sets":[]},{"id":"action.daemon","kind":"option","type":"boolean","destination":"DAEMON","bindings":{"bash":{"destination":"DAEMON","default_function":null,"validator":null}},"short":"","long":"--daemon","negative_long":"","metavar":"","help":"Start a managed bridge","required":false,"repeatable":false,"internal":false,"default":"false","dynamic_default":null,"environment_default":null,"store_constant":null,"ui":{"label":"","group":"Action","control":"auto","placeholder":"","advanced":false,"order":10,"min":null,"max":null,"step":null,"file_mode":"auto"},"choices":[],"sets":[]},{"id":"action.stop","kind":"option","type":"boolean","destination":"STOP","bindings":{"bash":{"destination":"STOP","default_function":null,"validator":null}},"short":"","long":"--stop","negative_long":"","metavar":"","help":"Stop the managed bridge","required":false,"repeatable":false,"internal":false,"default":"false","dynamic_default":null,"environment_default":null,"store_constant":null,"ui":{"label":"","group":"Action","control":"auto","placeholder":"","advanced":false,"order":20,"min":null,"max":null,"step":null,"file_mode":"auto"},"choices":[],"sets":[]},{"id":"action.client","kind":"option","type":"string","destination":"CLIENT_URL","bindings":{"bash":{"destination":"CLIENT_URL","default_function":null,"validator":null}},"short":"","long":"--client","negative_long":"","metavar":"URL","help":"Send a URL to the bridge","required":false,"repeatable":false,"internal":false,"default":null,"dynamic_default":null,"environment_default":null,"store_constant":null,"ui":{"label":"","group":"Action","control":"auto","placeholder":"","advanced":false,"order":30,"min":null,"max":null,"step":null,"file_mode":"auto"},"choices":[],"sets":[]},{"id":"action.client_file","kind":"option","type":"path","destination":"CLIENT_FILE","bindings":{"bash":{"destination":"CLIENT_FILE","default_function":null,"validator":null}},"short":"","long":"--client-file","negative_long":"","metavar":"PATH","help":"Send a PDF or DOCX path","required":false,"repeatable":false,"internal":false,"default":null,"dynamic_default":null,"environment_default":null,"store_constant":null,"ui":{"label":"","group":"Action","control":"auto","placeholder":"","advanced":false,"order":40,"min":null,"max":null,"step":null,"file_mode":"auto"},"choices":[],"sets":[]}],"constraints":[{"kind":"mutex","members":["action.daemon","action.stop","action.client","action.client_file"]}]}
