{"schema_version":1,"command":"bigdftmk","summary":"Build a BigDFT SDK container command","unknown_policy":"collect","bindings":{"bash":{"unknown_destination":"POSITIONAL"}},"ui":{"confirm":""},"items":[{"id":"interface.help","kind":"option","type":"boolean","destination":"UNIOPT_BUILTIN_HELP","bindings":{"bash":{"destination":"UNIOPT_BUILTIN_HELP","default_function":null,"validator":null}},"short":"-h","long":"--help","negative_long":"","metavar":"","help":"Show help and exit","required":false,"repeatable":false,"internal":false,"default":"false","dynamic_default":null,"environment_default":null,"store_constant":null,"ui":{"label":"","group":"","control":"hidden","placeholder":"","advanced":false,"order":null,"min":null,"max":null,"step":null,"file_mode":"auto"},"choices":[],"sets":[]},{"id":"interface.gui","kind":"option","type":"boolean","destination":"UNIOPT_BUILTIN_GUI","bindings":{"bash":{"destination":"UNIOPT_BUILTIN_GUI","default_function":null,"validator":null}},"short":"","long":"--gui","negative_long":"","metavar":"","help":"Open the graphical command-line advisor","required":false,"repeatable":false,"internal":false,"default":"false","dynamic_default":null,"environment_default":null,"store_constant":null,"ui":{"label":"","group":"","control":"hidden","placeholder":"","advanced":false,"order":null,"min":null,"max":null,"step":null,"file_mode":"auto"},"choices":[],"sets":[]},{"id":"container.display","kind":"option","type":"boolean","destination":"WITH_DISPLAY","bindings":{"bash":{"destination":"WITH_DISPLAY","default_function":null,"validator":null}},"short":"-X","long":"--display","negative_long":"","metavar":"","help":"Enable host display usage","required":false,"repeatable":false,"internal":false,"default":"false","dynamic_default":null,"environment_default":null,"store_constant":null,"ui":{"label":"","group":"Container","control":"auto","placeholder":"","advanced":false,"order":10,"min":null,"max":null,"step":null,"file_mode":"auto"},"choices":[],"sets":[]},{"id":"container.workdir","kind":"option","type":"boolean","destination":"WITH_WORKDIR","bindings":{"bash":{"destination":"WITH_WORKDIR","default_function":null,"validator":null}},"short":"-w","long":"--workdir","negative_long":"","metavar":"","help":"Mount the present directory","required":false,"repeatable":false,"internal":false,"default":"false","dynamic_default":null,"environment_default":null,"store_constant":null,"ui":{"label":"","group":"Container","control":"auto","placeholder":"","advanced":false,"order":20,"min":null,"max":null,"step":null,"file_mode":"auto"},"choices":[],"sets":[]},{"id":"container.keep","kind":"option","type":"boolean","destination":"KEEP","bindings":{"bash":{"destination":"KEEP","default_function":null,"validator":null}},"short":"-k","long":"--keep","negative_long":"","metavar":"","help":"Keep the container after it exits","required":false,"repeatable":false,"internal":false,"default":"false","dynamic_default":null,"environment_default":null,"store_constant":null,"ui":{"label":"","group":"Container","control":"auto","placeholder":"","advanced":false,"order":30,"min":null,"max":null,"step":null,"file_mode":"auto"},"choices":[],"sets":[]},{"id":"container.root","kind":"option","type":"boolean","destination":"EMPLOY_ROOT_USER","bindings":{"bash":{"destination":"EMPLOY_ROOT_USER","default_function":null,"validator":null}},"short":"-r","long":"--root","negative_long":"","metavar":"","help":"Run as root","required":false,"repeatable":false,"internal":false,"default":"false","dynamic_default":null,"environment_default":null,"store_constant":null,"ui":{"label":"","group":"Container","control":"auto","placeholder":"","advanced":false,"order":40,"min":null,"max":null,"step":null,"file_mode":"auto"},"choices":[],"sets":[]},{"id":"container.extra_commands","kind":"option","type":"string","destination":"EXTRA_COMMANDS","bindings":{"bash":{"destination":"EXTRA_COMMANDS","default_function":null,"validator":null}},"short":"-x","long":"--extra-cmd","negative_long":"","metavar":"ARG","help":"Additional docker run argument","required":false,"repeatable":false,"internal":false,"default":null,"dynamic_default":null,"environment_default":null,"store_constant":null,"ui":{"label":"","group":"Advanced","control":"auto","placeholder":"","advanced":true,"order":10,"min":null,"max":null,"step":null,"file_mode":"auto"},"choices":[],"sets":[]},{"id":"command.extra_positional","kind":"option","type":"string","destination":"EXTRA_POSITIONAL","bindings":{"bash":{"destination":"EXTRA_POSITIONAL","default_function":null,"validator":null}},"short":"-e","long":"--extra-positional","negative_long":"","metavar":"ARG","help":"Additional command argument","required":false,"repeatable":false,"internal":false,"default":null,"dynamic_default":null,"environment_default":null,"store_constant":null,"ui":{"label":"","group":"Command","control":"auto","placeholder":"","advanced":true,"order":10,"min":null,"max":null,"step":null,"file_mode":"auto"},"choices":[],"sets":[]},{"id":"container.home","kind":"option","type":"path","destination":"HOMEDIR","bindings":{"bash":{"destination":"HOMEDIR","default_function":null,"validator":null}},"short":"-d","long":"--homedir","negative_long":"","metavar":"PATH","help":"Container home directory","required":false,"repeatable":false,"internal":false,"default":"/tmp/fake_home","dynamic_default":null,"environment_default":null,"store_constant":null,"ui":{"label":"","group":"Container","control":"auto","placeholder":"","advanced":false,"order":50,"min":null,"max":null,"step":null,"file_mode":"auto"},"choices":[],"sets":[]},{"id":"container.gpu","kind":"option","type":"boolean","destination":"USE_GPU","bindings":{"bash":{"destination":"USE_GPU","default_function":null,"validator":null}},"short":"-g","long":"--gpus","negative_long":"","metavar":"","help":"Enable NVIDIA GPU access","required":false,"repeatable":false,"internal":false,"default":"false","dynamic_default":null,"environment_default":null,"store_constant":null,"ui":{"label":"","group":"Container","control":"auto","placeholder":"","advanced":false,"order":60,"min":null,"max":null,"step":null,"file_mode":"auto"},"choices":[],"sets":[]},{"id":"source.bigdft","kind":"option","type":"path","destination":"SOURCEDIR","bindings":{"bash":{"destination":"SOURCEDIR","default_function":"preview_bigdft_sources","validator":null}},"short":"-s","long":"--sources","negative_long":"","metavar":"PATH","help":"BigDFT source directory","required":false,"repeatable":false,"internal":false,"default":null,"dynamic_default":"preview_bigdft_sources","environment_default":null,"store_constant":null,"ui":{"label":"","group":"BigDFT","control":"auto","placeholder":"","advanced":false,"order":10,"min":null,"max":null,"step":null,"file_mode":"auto"},"choices":[],"sets":[]},{"id":"container.image","kind":"option","type":"string","destination":"CONTAINER","bindings":{"bash":{"destination":"CONTAINER","default_function":null,"validator":null}},"short":"-i","long":"--image","negative_long":"","metavar":"IMAGE","help":"SDK container image","required":false,"repeatable":false,"internal":false,"default":"bigdft/sdk:latest","dynamic_default":null,"environment_default":null,"store_constant":null,"ui":{"label":"","group":"BigDFT","control":"auto","placeholder":"","advanced":false,"order":20,"min":null,"max":null,"step":null,"file_mode":"auto"},"choices":[],"sets":[]},{"id":"output.binaries","kind":"option","type":"path","destination":"BINARIES","bindings":{"bash":{"destination":"BINARIES","default_function":"preview_bigdft_binaries","validator":null}},"short":"-b","long":"--binaries","negative_long":"","metavar":"PATH","help":"Binaries directory","required":false,"repeatable":false,"internal":false,"default":null,"dynamic_default":"preview_bigdft_binaries","environment_default":null,"store_constant":null,"ui":{"label":"","group":"BigDFT","control":"auto","placeholder":"","advanced":false,"order":30,"min":null,"max":null,"step":null,"file_mode":"auto"},"choices":[],"sets":[]},{"id":"output.target","kind":"option","type":"path","destination":"TARGET","bindings":{"bash":{"destination":"TARGET","default_function":null,"validator":null}},"short":"-t","long":"--target","negative_long":"","metavar":"PATH","help":"Target binaries directory","required":false,"repeatable":false,"internal":false,"default":"/opt/bigdft","dynamic_default":null,"environment_default":null,"store_constant":null,"ui":{"label":"","group":"BigDFT","control":"auto","placeholder":"","advanced":false,"order":40,"min":null,"max":null,"step":null,"file_mode":"auto"},"choices":[],"sets":[]},{"id":"network.port","kind":"option","type":"uint","destination":"PORT","bindings":{"bash":{"destination":"PORT","default_function":null,"validator":null}},"short":"-p","long":"--port","negative_long":"","metavar":"PORT","help":"Host port mapped to container port 8888","required":false,"repeatable":false,"internal":false,"default":null,"dynamic_default":null,"environment_default":null,"store_constant":null,"ui":{"label":"","group":"Network","control":"number","placeholder":"","advanced":false,"order":null,"min":"1","max":"65535","step":null,"file_mode":"auto"},"choices":[],"sets":[]}],"constraints":[]}
