{"schema_version":1,"command":"wise-down","summary":"Stop a WISE session","unknown_policy":"error","bindings":{"bash":{"unknown_destination":null}},"ui":{"confirm":"Stop this WISE session and perform the selected cleanup actions?"},"items":[{"id":"interface.help","kind":"option","type":"boolean","destination":"UNIOPT_BUILTIN_HELP","bindings":{"bash":{"destination":"UNIOPT_BUILTIN_HELP","default_function":null,"validator":null}},"short":"-h","long":"--help","negative_long":"","metavar":"","help":"Show help and exit","required":false,"repeatable":false,"internal":false,"default":"false","dynamic_default":null,"environment_default":null,"store_constant":null,"ui":{"label":"","group":"","control":"hidden","placeholder":"","advanced":false,"order":null,"min":null,"max":null,"step":null,"file_mode":"auto"},"choices":[],"sets":[]},{"id":"interface.gui","kind":"option","type":"boolean","destination":"UNIOPT_BUILTIN_GUI","bindings":{"bash":{"destination":"UNIOPT_BUILTIN_GUI","default_function":null,"validator":null}},"short":"","long":"--gui","negative_long":"","metavar":"","help":"Open the graphical command-line advisor","required":false,"repeatable":false,"internal":false,"default":"false","dynamic_default":null,"environment_default":null,"store_constant":null,"ui":{"label":"","group":"","control":"hidden","placeholder":"","advanced":false,"order":null,"min":null,"max":null,"step":null,"file_mode":"auto"},"choices":[],"sets":[]},{"id":"session.env_file","kind":"option","type":"path","destination":"ENV_FILE","bindings":{"bash":{"destination":"ENV_FILE","default_function":null,"validator":null}},"short":"","long":"--env-file","negative_long":"","metavar":"PATH","help":"Env file to use","required":false,"repeatable":false,"internal":false,"default":null,"dynamic_default":null,"environment_default":null,"store_constant":null,"ui":{"label":"Environment file","group":"Session","control":"auto","placeholder":"","advanced":false,"order":20,"min":null,"max":null,"step":null,"file_mode":"auto"},"choices":[],"sets":[]},{"id":"session.name","kind":"option","type":"string","destination":"OV_NAME","bindings":{"bash":{"destination":"OV_NAME","default_function":null,"validator":null}},"short":"","long":"--name","negative_long":"","metavar":"NAME","help":"Select a named WISE session","required":false,"repeatable":false,"internal":false,"default":null,"dynamic_default":null,"environment_default":null,"store_constant":null,"ui":{"label":"Session name","group":"Session","control":"auto","placeholder":"","advanced":false,"order":10,"min":null,"max":null,"step":null,"file_mode":"auto"},"choices":[],"sets":[]},{"id":"compose.extra","kind":"option","type":"path","destination":"EXTRA_COMPOSE","bindings":{"bash":{"destination":"EXTRA_COMPOSE","default_function":null,"validator":null}},"short":"","long":"--extra-compose","negative_long":"","metavar":"PATH","help":"Add an extra Docker Compose file","required":false,"repeatable":true,"internal":false,"default":null,"dynamic_default":null,"environment_default":null,"store_constant":null,"ui":{"label":"","group":"Compose","control":"list","placeholder":"","advanced":false,"order":10,"min":null,"max":null,"step":null,"file_mode":"auto"},"choices":[],"sets":[]},{"id":"prune.inner","kind":"option","type":"boolean","destination":"PRUNE_INNER","bindings":{"bash":{"destination":"PRUNE_INNER","default_function":null,"validator":null}},"short":"","long":"--prune-inner-containers","negative_long":"","metavar":"","help":"Prune inner images, networks, and build cache","required":false,"repeatable":false,"internal":false,"default":"false","dynamic_default":null,"environment_default":null,"store_constant":null,"ui":{"label":"","group":"Cleanup","control":"auto","placeholder":"","advanced":false,"order":10,"min":null,"max":null,"step":null,"file_mode":"auto"},"choices":[],"sets":[]},{"id":"prune.volumes","kind":"option","type":"boolean","destination":"PRUNE_VOLUMES","bindings":{"bash":{"destination":"PRUNE_VOLUMES","default_function":null,"validator":null}},"short":"","long":"","negative_long":"","metavar":"","help":"","required":false,"repeatable":false,"internal":true,"default":"false","dynamic_default":null,"environment_default":null,"store_constant":null,"ui":{"label":"","group":"","control":"auto","placeholder":"","advanced":false,"order":null,"min":null,"max":null,"step":null,"file_mode":"auto"},"choices":[],"sets":[]},{"id":"prune.inner_volumes","kind":"alias","type":"string","destination":"","bindings":{"bash":{"destination":null,"default_function":null,"validator":null}},"short":"","long":"--prune-inner-container-volumes","negative_long":"","metavar":"","help":"Also prune inner Docker volumes","required":false,"repeatable":false,"internal":false,"default":null,"dynamic_default":null,"environment_default":null,"store_constant":null,"ui":{"label":"","group":"Cleanup","control":"auto","placeholder":"","advanced":false,"order":20,"min":null,"max":null,"step":null,"file_mode":"auto"},"choices":[],"sets":[{"id":"prune.inner","value":"true"},{"id":"prune.volumes","value":"true"}]},{"id":"prune.data_volume","kind":"option","type":"boolean","destination":"REMOVE_DATA_VOLUME","bindings":{"bash":{"destination":"REMOVE_DATA_VOLUME","default_function":null,"validator":null}},"short":"","long":"--remove-inner-container-volume","negative_long":"","metavar":"","help":"Remove the shared sidecar data volume","required":false,"repeatable":false,"internal":false,"default":"false","dynamic_default":null,"environment_default":null,"store_constant":null,"ui":{"label":"","group":"Cleanup","control":"auto","placeholder":"","advanced":false,"order":30,"min":null,"max":null,"step":null,"file_mode":"auto"},"choices":[],"sets":[]}],"constraints":[]}
